{
  "$schema": "https://json-schema.org/draft/2020-12/schema",
  "title": "AI Offering Assessment",
  "type": "object",
  "required": [
    "vendor",
    "version",
    "review_date",
    "item_type",
    "capability_type",
    "tier",
    "gates",
    "scores",
    "positioning",
    "recommendation"
  ],
  "properties": {
    "vendor": { "type": "string" },
    "version": { "type": "string" },
    "review_date": { "type": "string", "format": "date" },
    "item_type": { "type": "string" },
    "capability_type": { "type": "string" },
    "tier": { "type": "string" },
    "gates": {
      "type": "object",
      "additionalProperties": {
        "type": "string",
        "enum": ["Pass", "Fail", "N/A"]
      }
    },
    "scores": {
      "type": "object",
      "required": ["governance", "architecture", "capability", "procurement", "composite"],
      "properties": {
        "governance": { "type": "number" },
        "architecture": { "type": "number" },
        "capability": { "type": "number" },
        "procurement": { "type": "number" },
        "composite": { "type": "number" }
      }
    },
    "positioning": {
      "type": "object",
      "required": ["openness", "sovereignty", "runtime"],
      "properties": {
        "openness": { "type": "string" },
        "sovereignty": { "type": "string" },
        "runtime": { "type": "string" }
      }
    },
    "recommendation": { "type": "string" },
    "metadata": {
      "type": "object",
      "properties": {
        "reviewer": { "type": "string" },
        "status": { "type": "string" },
        "latest": { "type": "boolean" }
      }
    }
  }
}
